error,baseUrl,timestamp,linkedinProfileUrl,email,linkedinProfile,description,headline,location,imgUrl,firstName,lastName,fullName,subscribers,connectionDegree,vmid,userId,linkedinSalesNavigatorUrl,connectionsCount,connectionsUrl,mutualConnectionsUrl,mutualConnectionsText,company,jobTitle,jobDescription,jobLocation,jobDateRange,jobDuration,company2,jobTitle2,jobDescription2,jobLocation2,jobDateRange2,jobDuration2,school,schoolUrl,schoolDegree,schoolDescription,school2,schoolDegree2,schoolDescription2,twitter,twitterProfileUrl,allSkills,skill1,endorsement1,skill2,endorsement2,skill3,endorsement3,skill4,endorsement4,skill5,endorsement5,skill6,endorsement6,profileId,mail,companyUrl,companyUrl2,schoolUrl2,website,schoolDateRange,schoolDateRange2,birthday,facebookUrl
,"https://www.linkedin.com/sales/lead/ACwAADguj5IBs22Qk4WL-bpOCfu8AuObrCNoSBg,NAME_SEARCH,nIbz",2023-08-03T06:42:07.899Z,https://www.linkedin.com/in/brendon-roberts/,,https://www.linkedin.com/in/brendon-roberts/,"Talent Acquisition ۰ Lifecycle Recruiting ۰ Personnel Management ۰ Mentor & Coach ۰ Onboarding & Off-boarding Training & Development ۰ Procedure & Policy Development ۰ Organizational Management

Exceptionally experienced human resources management professional with outstanding leadership and management skills accentuate ability to reliably deliver outstanding results in fast-paced, challenging environments and demanding atmospheres.

Mentor, coach and trainer noted for inspiring others to strive for excellence in their pursuits, pursue personal and professional growth and development, work cohesively as a team, and drive one and all to collectively succeed.

Excellent interpersonal and communication skills are hallmarks of a leader noted for clearly communicating persuasively at all levels enterprise-wide, able to obtain buy-in and support, and enlist others to adopt the program and execute with precision.

Extensive experience developing, analyzing and reviewing project efficiency, personnel utilization and effective distribution of resources underscore ability to keenly evaluate program effectiveness, organization function and structure, and proficiently develop, implement and manage projects and controls across the organization.

A strong work ethic emphasizing resourcefulness, reliability and accountability illustrate a leader by example noted for meeting extraordinary challenges, overcoming obstacles, solving multifaceted problems, and achieving exceptional results.

Professional Development & Certifications:
Project Management Academy 2022
Applied Suicide Intervention Skills Training 2020
Resiliency Training 2019                                                                                                                                                               
Sexual Assault Prevention Response Victim Advocate 2018",Department of State,"Woodbridge, Virginia, United States",https://media.licdn.com/dms/image/D4E03AQEaZ7rEUFlG2A/profile-displayphoto-shrink_800_800/0/1664942731114?e=1696464000&v=beta&t=sqwu-ljmQcXMLubaNPyFdiHSy-HECUXi9SL-K5HYJjo,Brendon,Roberts,Brendon Roberts,234,3rd,ACoAADguj5IBtMpmV_LXyZoqRbagP0RLAVRp8tE,942575506,"https://www.linkedin.com/sales/people/ACoAADguj5IBtMpmV_LXyZoqRbagP0RLAVRp8tE,name",229,https://www.linkedin.com/search/results/people/?facetConnectionOf=%5B%22ACoAADguj5IBtMpmV_LXyZoqRbagP0RLAVRp8tE%22%5D&facetNetwork=%5B%22F%22%2C%22S%22%5D&origin=MEMBER_PROFILE_CANNED_SEARCH,https://www.linkedin.com/search/results/people/?facetNetwork=%5B%22F%22%5D&facetConnectionOf=%5B%22ACoAADguj5IBtMpmV_LXyZoqRbagP0RLAVRp8tE%22%5D&origin=MEMBER_PROFILE_CANNED_SEARCH&RESULT_TYPE=PEOPLE,,U.S. Department of State,Human Capital Management Consultant,Skills: Teamwork · Microsoft Office · Workforce Planning · Human Resources (HR),"Washington, District of Columbia, United States",Aug 2022 - Present,1 yr 1 mo,United States Department of Defense,Administrative Manager,"Coordinated, performed, and managed tasks and activities in direct support of organizational commanders, directors, and senior leaders, to include office management, human resources, executive staff support, postal, official mail, and an array of other services and duties.

Managed nine organization schedules, including five special clearance programs.

Obtained program clients’ feedback and developed initiatives and resolutions.

Audited cyclical compliance, including President Support Programs.

Managed automated time system; certified accuracy of 11,000 reported hours.

Operated administration inbox and answered email queries within 24 hours.","Washington, District of Columbia, United States",Oct 2021 - Aug 2022,11 mos,University of Maryland,https://www.linkedin.com/company/3638/,"Bachelor's degree, Human Resources Management and Services",,University of Maryland,"Associate's degree, Business Administration and Management, General",,,,"Teamwork, Microsoft Office, Code of Federal Regulations, Supply Chain Management, Customer Relationship Management (CRM), Strategy, E-Commerce, Hiring, Supervisory Skills, Government, Workforce Planning, Analytical Skills, Financial Analysis, Requirements Analysis, Conflict Management, Conflict Resolution, Conflict Analysis, Conflict Prevention, Business Analysis, Data Analysis, Account Management, Auditing, Continuous Improvement, Customer Service, Training & Development, Training, Logistics Engineering, Management, Critical Thinking, Problem Solving, Communication, Leadership",Teamwork,81,Microsoft Office,41,Code of Federal Regulations,3,Supply Chain Management,,Customer Relationship Management (CRM),,Strategy,,brendon-roberts,,https://www.linkedin.com/company/3100/,https://www.linkedin.com/company/7510/,https://www.linkedin.com/company/3638/,,Dec 2021,Dec 2020,,
,"https://www.linkedin.com/sales/lead/ACwAACo5uCEBeXdGVe_TalhxmWjYeLg-l9cviCw,NAME_SEARCH,Sh4w",2023-08-03T06:42:28.545Z,https://www.linkedin.com/in/sabrinateichman/,,https://www.linkedin.com/in/sabrinateichman/,"Sabrina is an entrepreneurially-minded leader who started her career in public service with the United States Government before moving to the private/non-profit sectors.  Over the course of the past decade+, she has held several leadership roles across the U.S. foreign policy and national security sector focused on the intersection of security, international development, trade, and investment. She has worked closely with public and private sector leaders around the globe, Fortune 100 companies, financial institutions, multilateral and non-governmental organizations and small businesses to advance key initiatives to enhance global security and prosperity while accelerating trade and investment. 

Sabrina is passionate about social impact and serves as an Advisor to several non-profit organizations, business councils and companies of all sizes. She is especially energized by innovative projects, programs and partnerships to empower women and entrepreneurs from traditionally under-served regions and backgrounds in the U.S. and emerging markets. She is equally passionate about ensuring children and vulnerable communities have access to vital resources to grow, prosper and thrive. 

Sabrina is proud to be a first-generation American of Algerian and French heritage and enjoys facilitating a greater sense of community between Americans from different cultural backgrounds and regions. She is the host and creator of a podcast called Belong in the USA that explores the theme of identity in the United States through the experiences of immigrants and first generation Americans. Season 1 of Belong in the USA podcast is out now on Apple Podcasts.",Global Policy | Social Impact | Strategy + Partnerships 🌎,"Washington, District of Columbia, United States",https://media.licdn.com/dms/image/C4D03AQF46CSpRB8Kzw/profile-displayphoto-shrink_800_800/0/1637005403606?e=1696464000&v=beta&t=EMOVU37stiT_lT-icoN6RzZ8vPjZE5x_yUrYpPVlWi0,Sabrina,T.,Sabrina T.,2563,2nd,ACoAACo5uCEBhwCg5qXHce-aTH82Vh84t9p-Q-g,708425761,"https://www.linkedin.com/sales/people/ACoAACo5uCEBhwCg5qXHce-aTH82Vh84t9p-Q-g,name",500,https://www.linkedin.com/search/results/people/?facetConnectionOf=%5B%22ACoAACo5uCEBhwCg5qXHce-aTH82Vh84t9p-Q-g%22%5D&facetNetwork=%5B%22F%22%2C%22S%22%5D&origin=MEMBER_PROFILE_CANNED_SEARCH,https://www.linkedin.com/search/results/people/?facetNetwork=%5B%22F%22%5D&facetConnectionOf=%5B%22ACoAACo5uCEBhwCg5qXHce-aTH82Vh84t9p-Q-g%22%5D&origin=MEMBER_PROFILE_CANNED_SEARCH&RESULT_TYPE=PEOPLE,Chris Lee is a mutual connection,Women for Women International,Senior Manager Global Government Relations,,,Sep 2022 - Present,1 yr,Strategie,Founder and Principal,"Strategic advisory and consulting firm supporting innovation, inclusion and impact at the intersection of public, private and philanthropic interests.",,Aug 2021 - Present,2 yrs 1 mo,Georgetown University,https://www.linkedin.com/company/4794/,MA - International Business and Policy,"Joint degree from Walsh School of Foreign Service and McDonough School of Business
Focus on Emerging Markets, International Trade and Sustainable Development",University of Maryland,BA - Government and Politics,,,,"International Relations, Strategic Thinking, Program Management, Business Strategy, Government, Business Development, Emerging Markets, Public Policy, Strategy, Program Development, International Development, Foreign Policy, Policy Analysis, Social Entrepreneurship, Creative Strategy, Strategic Planning, National Security, Start-ups, Strategic Consulting, Investment Advisory, Trade Finance, Project Finance, Change Management, Strategic Partnerships, Leadership, Public Speaking, Decision Making, Creative Problem Solving, Mentoring, Self-motivation",International Relations,35,Strategic Thinking,25,Program Management,29,Business Strategy,5,Government,13,Business Development,6,sabrinateichman,,https://www.linkedin.com/company/36912/,https://www.linkedin.com/company/76127863/,https://www.linkedin.com/company/3638/,calendly.com/sabrinateichman,2020,2009,July 8,
,"https://www.linkedin.com/sales/lead/ACwAAAP9AH0B_H1eVd5j56GVPvuAESbX_P08-Gk,NAME_SEARCH,roJg",2023-08-03T06:42:48.899Z,https://www.linkedin.com/in/santa-oldham-5394aa1a/,,https://www.linkedin.com/in/santa-oldham-5394aa1a/,"A leader, a mentor and coach, sharing information, showing the way, and helping clear a path to career growth for young professionals and colleagues.  Results driven Healthcare Executive with several years of progressive experience in Healthcare Management administration, policy development and implementation, Quality Management, Managed Care, and health outcomes.  Expert at negotiating and managing contracts, building strong client and staff relationships and creating a positive environment to accomplish organization mission, promote values and bring visions to reality. Demonstrated expertise in leading teams to success while achieving quality and performance goals to growth and profitability.",Certified Professional Life Coach,"Mount Airy, Maryland, United States",https://media.licdn.com/dms/image/C4E03AQGSqNMAd5iYgA/profile-displayphoto-shrink_800_800/0/1555198206277?e=1696464000&v=beta&t=oHgd0fpY-rFG-c603vLWPPyOWfAynwreR_QgYV7SWT4,Santa,Oldham,Santa Oldham,325,3rd,ACoAAAP9AH0BBeQWQ4IjaXtNwFR23XqLXP_U6RY,66912381,"https://www.linkedin.com/sales/people/ACoAAAP9AH0BBeQWQ4IjaXtNwFR23XqLXP_U6RY,name",322,https://www.linkedin.com/search/results/people/?facetConnectionOf=%5B%22ACoAAAP9AH0BBeQWQ4IjaXtNwFR23XqLXP_U6RY%22%5D&facetNetwork=%5B%22F%22%2C%22S%22%5D&origin=MEMBER_PROFILE_CANNED_SEARCH,https://www.linkedin.com/search/results/people/?facetNetwork=%5B%22F%22%5D&facetConnectionOf=%5B%22ACoAAAP9AH0BBeQWQ4IjaXtNwFR23XqLXP_U6RY%22%5D&origin=MEMBER_PROFILE_CANNED_SEARCH&RESULT_TYPE=PEOPLE,,Assistance In Action,Principal,"Providing personal, business, and organizational assistance to allow clients to better manage their businesses and homes.","Bethesda, Maryland",May 2015 - Present,8 yrs 4 mos,Guidehouse (formerly Navigant),Associate Director,,"1200 19th Street NW Washington, DC",Apr 2019 - Sep 2020,1 yr 6 mos,University of Maryland,https://www.linkedin.com/company/3638/,"Bachelor of Science, Marketing",,,,,,,"Management Consulting, Managed Health Care, Contract Negotiation and Management, Medicaid, Health Policy, Medicare, Healthcare Consulting, Healthcare, Strategic Planning, Program Management, Healthcare Information Technology, Contract Negotiation, Non-profits, Policy Analysis, Strategy, Managed Care, Project Management, Strategic Thinking, Nonprofits, Hospitals, Business Process Improvement, Program Development, Community Outreach, Team Building, Contract Management, Public Speaking, Leadership",Management Consulting,6,Managed Health Care,,Contract Negotiation and Management,,Medicaid,28,Health Policy,16,Medicare,10,santa-oldham-5394aa1a,,,,,,1980 - 1984,,,
,"https://www.linkedin.com/sales/lead/ACwAACduM1EB8KGBDK5Fa0-GSt_raZ6PmneUMbg,NAME_SEARCH,WCqj",2023-08-03T06:43:08.801Z,https://www.linkedin.com/in/tia-jackson-a95667165/,,https://www.linkedin.com/in/tia-jackson-a95667165/,"Highly adaptable relationship builder, communicator, problem-solver, and cross-functional/organizational leader with a career of driving business outcomes through effective project management. Frequently called upon to rescue and deliver projects across the finish line by engaging with key stakeholders, understanding business objectives, aligning project resources, and planning and executing strategic and tactical priorities.","Senior Director at Cobec Consulting, Inc.","Port Republic, Maryland, United States",,Tia,Jackson,Tia Jackson,121,3rd,ACoAACduM1EBAcC8m01aSuEUyr2FnFJuikOAgBk,661533521,"https://www.linkedin.com/sales/people/ACoAACduM1EBAcC8m01aSuEUyr2FnFJuikOAgBk,name",120,https://www.linkedin.com/search/results/people/?facetConnectionOf=%5B%22ACoAACduM1EBAcC8m01aSuEUyr2FnFJuikOAgBk%22%5D&facetNetwork=%5B%22F%22%2C%22S%22%5D&origin=MEMBER_PROFILE_CANNED_SEARCH,https://www.linkedin.com/search/results/people/?facetNetwork=%5B%22F%22%5D&facetConnectionOf=%5B%22ACoAACduM1EBAcC8m01aSuEUyr2FnFJuikOAgBk%22%5D&origin=MEMBER_PROFILE_CANNED_SEARCH&RESULT_TYPE=PEOPLE,,"Cobec Consulting, Inc.",Senior Director,"Serve as the single point-of-contact with the customer program office for management of technical matters and contract-level issues. Responsible for managing cost, schedule, quality, and risk to ensure the contractual requirements are met; provide financial reports, collect, and analyze project metrics; prepare and participate in informal and formal reviews. Responsible for day-to-day management as well as long-term strategic development Direct program activities to meet client and organization work objectives and serve as a liaison with the client stakeholders to coordinate activities, negotiate tasks, and solve problems.  Reports to the customer and management on the status of all financial, technical, administrative, contractual, and personnel aspects of the contract.  Expertly manage cross-functional teams responsible for delivering high-quality program capabilities on time and within budget, including subcontractors. Ensure all work complies with the contract terms and conditions Identifies, assesses, and resolves complex business problems / issue / risks. Ensure innovation and optimization are ongoing processes. Coordinate resources needed for effective program management.  Responsible for profitability and revenue growth of assigned programs Lead, manage, coach, and mentor employees, manage professional development, hiring, and issue resolution for the program.  Engages employees and customers on a routine basis to fully understand customer requirements and employee capabilities Delivers reports and technical reviews to senior management as requested.","Washington, District of Columbia, United States",Oct 2019 - Present,3 yrs 11 mos,"Cobec Consulting, Inc.",Associate Director,"Provide oversight, training, and mentoring.  Participate in program reviews, month end close reviews, and estimate at complete reviews.  Provide support for new project transitions/phase-ins as needed. Assist in corporate level certifications and processes. Recruit and hire experienced program support where needed.  Assist with proposal reviews.  Communicate with the Project Management and Controls communities via Center of Excellence forums, intranet postings and monthly newsletters.  Assist with project planning/scheduling/baseline development, cost/variance analysis, project setup, and project reporting. Working in a highly visible, fast paced, high volume role, in which will at times required to be hands on in executing work under tight deadlines, as well as hold team members accountable for quality, compliance and delivery of time - sensitive work products. Developing staff and managing distribution of workload, to include managing timelines, deliverables, and special projects. Ensuring the team meets internal and external SLAs",Washington DC-Baltimore Area,Nov 2015 - Oct 2019,4 yrs,University of Maryland,https://www.linkedin.com/company/3638/,"Bachelor of Business Administration - BBA, Accounting and Business/Management",Skills: Business Management · Reporting & Analysis · Business Analysis · Funding,,,,,,"Service Delivery, Business Analytics, Project Delivery, Project Implementation, Funding, Business Management, Reporting & Analysis, Budgeting, Facility Management (FM), Strategic Leadership, Change Management, Technical Requirements, Strategic Vision, Professional Responsibility, Executive Level Management, Organizational Effectiveness, Client Relations, Project Coordination, Cross-functional Team Leadership, Relationship Building, Project Portfolio Management, Adobe Photoshop, Mentoring, Cooperation, Analytical Skills, Problem Solving, Communication, Management, Leadership, Strategic Planning, Strategy",Service Delivery,2,Business Analytics,,Project Delivery,41,Project Implementation,42,Funding,,Business Management,,tia-jackson-a95667165,,https://www.linkedin.com/company/708943/,https://www.linkedin.com/company/708943/,,,,,,
,"https://www.linkedin.com/sales/lead/ACwAAAPk3oYBC7Qb_3NbVbvvMkg-hWQjWRDfV1w,NAME_SEARCH,LhKp",2023-08-03T06:43:29.236Z,https://www.linkedin.com/in/patrizia-somavilla-232a6719/,,https://www.linkedin.com/in/patrizia-somavilla-232a6719/,,Management Consultant at PwC,"McLean, Virginia, United States",,Patrizia,Somavilla,Patrizia Somavilla,307,3rd,ACoAAAPk3oYB-pCgnlmOOsQalBD6C5fWx5Pyw94,65330822,"https://www.linkedin.com/sales/people/ACoAAAPk3oYB-pCgnlmOOsQalBD6C5fWx5Pyw94,name",309,https://www.linkedin.com/search/results/people/?facetConnectionOf=%5B%22ACoAAAPk3oYB-pCgnlmOOsQalBD6C5fWx5Pyw94%22%5D&facetNetwork=%5B%22F%22%2C%22S%22%5D&origin=MEMBER_PROFILE_CANNED_SEARCH,https://www.linkedin.com/search/results/people/?facetNetwork=%5B%22F%22%5D&facetConnectionOf=%5B%22ACoAAAPk3oYB-pCgnlmOOsQalBD6C5fWx5Pyw94%22%5D&origin=MEMBER_PROFILE_CANNED_SEARCH&RESULT_TYPE=PEOPLE,,PwC,Senior Management Consultant,"Ms. Somavilla is a senior business management consultant with experience in the public and private sectors and a passion for solving problems.  Industries include healthcare, transportation, hospitality, manufacturing, and financial services. 

As a technologist, she is an expert in leading transformation projects that include a technical implementation.  Her experience ranges from financial system implementations, such as Oracle and SAP, to people-oriented systems, such as PeopleSoft and custom Talent Management.  She has led numerous work streams focused on the re-engineering of processes that improve organization agility. 

As a Change Management leader, she has led numerous efforts that integrate people and technology.  Her strong communication skills include the development of internal and external stakeholders’ plans and targeted communications activities that were disseminated through multiple channels.  She has also supervised the development of multiple training initiative to promote the readiness of organizations that undergo major changes while maintaining business continuity. 

She is an accomplished project manager with the skills and expertise to deliver projects that are financially sound and profitable.  She has a strong attention to details and works deliberately to mentor her team in the art of project execution and client management.  Her work style is structured and organized with an advanced ability in planning and executing while maintaining the flexibility required to address changing requirements.

She has extensive business development experience to include strong pricing, writing and technical approach development skills.   She writes and leads the development of complex proposals, task order response, and the capture of Government-wide, multi-year, IDIQ contracts.  Develops and executes against the opportunity pipeline and call plan to market and sell enterprise level software development services. 
",,Apr 2006 - Present,17 yrs 5 mos,Deloitte,Manager,"Focused on system implementation, gathered requirements, developed test scripts and supported various cycles of testing, including User Acceptance and Regression.  She also created training materials, user guides, step-by-step procedures, instructor slides, and flow charts.  ",,Mar 2004 - Apr 2006,2 yrs 2 mos,University of Maryland,https://www.linkedin.com/company/3638/,"Bachelor of Science - BS, Mechanical Engineering",,,,,,,"Change Management, Business Process Re-engineering, Organizational Design, Management Consulting, Business Transformation, Performance Improvement, Talent Management, Business Process Improvement, Strategic Communications, Organizational Development, Human Capital, Organizational Effectiveness, Consulting, Process Improvement, Performance Management, Program Management, Project Management, Strategic Planning, Strategy",Change Management,14,Business Process Re-engineering,5,Organizational Design,11,Management Consulting,19,Business Transformation,12,Performance Improvement,5,patrizia-somavilla-232a6719,,https://www.linkedin.com/company/1044/,https://www.linkedin.com/company/1038/,,,,,,
,"https://www.linkedin.com/sales/lead/ACwAAAZXWocB9v8cE3ZRQplcxvUlHOw2ZN0zQDg,NAME_SEARCH,b4E7",2023-08-03T09:40:08.944Z,https://www.linkedin.com/in/kate-bodner/,,https://www.linkedin.com/in/kate-bodner/,,BCG Consultant,Washington DC-Baltimore Area,https://media.licdn.com/dms/image/C5603AQHZlpj9Rm-bVg/profile-displayphoto-shrink_800_800/0/1654179014873?e=1696464000&v=beta&t=D4yvQD5YRAfsCFfcj6OFHc4rtY3ZQOShbN61Dx1GG9U,Kate,Bodner,Kate Bodner,1301,2nd,ACoAAAZXWocBEQ0RP_CbPmXTalZHvGO8iD-ovDQ,106388103,"https://www.linkedin.com/sales/people/ACoAAAZXWocBEQ0RP_CbPmXTalZHvGO8iD-ovDQ,name",1301,https://www.linkedin.com/search/results/people/?facetConnectionOf=%5B%22ACoAAAZXWocBEQ0RP_CbPmXTalZHvGO8iD-ovDQ%22%5D&facetNetwork=%5B%22F%22%2C%22S%22%5D&origin=MEMBER_PROFILE_CANNED_SEARCH,https://www.linkedin.com/search/results/people/?facetNetwork=%5B%22F%22%5D&facetConnectionOf=%5B%22ACoAAAZXWocBEQ0RP_CbPmXTalZHvGO8iD-ovDQ%22%5D&origin=MEMBER_PROFILE_CANNED_SEARCH&RESULT_TYPE=PEOPLE,Juan J. Acosta is a mutual connection,Boston Consulting Group (BCG),Consultant,,,Aug 2022 - Present,1 yr 1 mo,Georgetown University McDonough School of Business,Graduate Teaching Assistant - Financial Markets and Corporate Decision Making,,,Aug 2021 - Dec 2021,5 mos,Georgetown University McDonough School of Business,https://www.linkedin.com/company/1300976/,Master of Business Administration - MBA,,University of Maryland,"BS, Mechanical Engineering",,,,"Pro Engineer, Solidworks, Mechanical Engineering, Revit, Solid Modeling, Matlab, Engineering Management, VBA, Design for Manufacturing, Revit MEP, AutoCAD Mechanical, Trace 700, COMcheck, EnvStd4.0, Primavera, HVAC Design, Construction, HVAC, SolidWorks",Pro Engineer,11,Solidworks,8,Mechanical Engineering,11,Revit,5,Solid Modeling,2,Matlab,6,kate-bodner,,https://www.linkedin.com/company/1784/,https://www.linkedin.com/company/1300976/,https://www.linkedin.com/company/3638/,,2020 - 2022,2006 - 2010,,
