error,baseUrl,timestamp,linkedinProfileUrl,email,linkedinProfile,description,headline,location,imgUrl,firstName,lastName,fullName,subscribers,connectionDegree,vmid,userId,linkedinSalesNavigatorUrl,connectionsCount,connectionsUrl,mutualConnectionsUrl,mutualConnectionsText,company,jobTitle,jobDescription,jobLocation,jobDateRange,jobDuration,company2,jobTitle2,jobDescription2,jobLocation2,jobDateRange2,jobDuration2,school,schoolUrl,schoolDegree,schoolDescription,school2,schoolDegree2,schoolDescription2,twitter,twitterProfileUrl,allSkills,skill1,endorsement1,skill2,endorsement2,skill3,endorsement3,skill4,endorsement4,skill5,endorsement5,skill6,endorsement6,profileId,mail,companyUrl,companyUrl2,schoolUrl2,website,schoolDateRange,schoolDateRange2,birthday,facebookUrl
Not a LinkedIn Profile URL,profileUrl,2023-07-19T19:21:54.310Z,,,,,,,,,,,,,,,,,,,,,,,,,,,,,,,,,,,,,,,,,,,,,,,,,,,,,,,,,,,,,,,
,"https://www.linkedin.com/sales/lead/ACwAAAHVj44Brlumxgp-o7YP0oARKp_kKER4e6k,NAME_SEARCH,SgLU",2023-07-19T19:22:11.128Z,https://www.linkedin.com/in/maureenbcthomas/,,https://www.linkedin.com/in/maureenbcthomas/,"A visionary strategist, entrepreneur and innovative change agent focused on delivering customer-centric solutions, Maureen Thomas is known for accelerating strategic partnerships across sectors in an organic inclusive process that builds on the diverse talents and strengths of the partnering organizations, team members and stakeholders. 
Ms. Thomas served in the Naval Reserves as a liaison officer, duty briefer and public affairs officer. After earning a masters degree in management and public policy from the University of Maryland School of Public Policy, she gained experience working in the federal space before moving into industry, nonprofit management, and ultimately founding her own startup. Ms. Thomas brings unique talents as a tech translator, connector, motivator and accelerator of innovative change. Specialties include branding, scaling outreach and operations, diversifying revenue streams, and building strategic public/private partnerships for organizations focused on growing a sustainable and innovative culture. Experience includes serving as team lead for strategic planning and change management in growth-oriented and startup environments requiring a multi-disciplinary approach to developing and initiating new opportunities for small businesses while working with a diverse mix of stakeholders. Ms. Thomas has established a reputation as an energetic, creative and collaborative problem-solver with a demonstrated passion for growing mission-oriented organizations and advocating for small businesses, including working with veteran-owned and women-owned small businesses.

Ms. Thomas serves frequently as speaker/panelist and organizes virtual and hybrid conferences and technical symposiums on entrepreneurship, women in innovation, small business opportunities/startup funding vehicles, technology and SBIR/STTR. She has published articles on small business challenges in tech industries, including satellite, microelectronics, cyber and UAS/UAV. In her free time she can be found working on her restored sailboat or cycling the C&O canal.",Stakeholder Engagement I Innovative Coalition Builder l Branding Coach l Publicist I Public-Private Partnerships,Washington DC-Baltimore Area,https://media.licdn.com/dms/image/C5603AQGVCIICYUNjVA/profile-displayphoto-shrink_100_100/0/1517688611515?e=1695254400&v=beta&t=D9hKk_SM2zF3tv8QtuVX3U8Br8AdwOFtAXs9dWfPIiE,Maureen,Cusick Thomas,Maureen Cusick Thomas,2379,2nd,ACoAAAHVj44BSy59aEaFznDBK6ikvRl6kJU15aU,30773134,"https://www.linkedin.com/sales/people/ACoAAAHVj44BSy59aEaFznDBK6ikvRl6kJU15aU,name",500,https://www.linkedin.com/search/results/people/?facetConnectionOf=%5B%22ACoAAAHVj44BSy59aEaFznDBK6ikvRl6kJU15aU%22%5D&facetNetwork=%5B%22F%22%2C%22S%22%5D&origin=MEMBER_PROFILE_CANNED_SEARCH,https://www.linkedin.com/search/results/people/?facetNetwork=%5B%22F%22%5D&facetConnectionOf=%5B%22ACoAAAHVj44BSy59aEaFznDBK6ikvRl6kJU15aU%22%5D&origin=MEMBER_PROFILE_CANNED_SEARCH&RESULT_TYPE=PEOPLE,"Daniel D. Kunitz, Thomas Luginbill, and 5 other mutual connections",tapas consulting,Principal Consultant,Skills: Organizational Design · Organizational Effectiveness · Executive Visibility · Client Services · Communication · Executive Management · Teamwork · Business Process Improvement · Publicity,Washington D.C. Metro Area,Feb 2018 - Present,5 yrs 6 mos,tapas consulting,Senior Consultant,"Deliver direct client services as virtual collaborator or inhouse team member. Serve as chief outreach officer developing and implementing strategic planning and operations outreach, change management, and construction of innovation ecosystems. Serve as executive level coach/advisor for small business/nonprofit organizations and public-private sector initiatives seeking to scale. With emphasis on scaling stakeholder engagement and client discovery, serve as trusted advisor to senior management seeking to achieve organizational mission and objectives in timely and efficient process. Work with collaborative diverse and inclusive team to deliver game changing results for clients seeking to improve CX for stakeholders, strengthen public/private sector outreach and branding. Experience in working with public/private sector partnerships, DoD, small businesses, university incubators and innovation districts, government contractors, and nonprofits at local, regional, state, federal, national and international levels.","Tenleytown, Washington, D.C.",Mar 2016 - Feb 2018,2 yrs,University of Maryland,https://www.linkedin.com/company/3638/,"Masters in Management and Public Policy, Public/Private Sector Relations","Masters Thesis, Office of Japanese Trade Policy, U.S. Treasury Dept.;
Asst. to Senior Economist,  MCI Corporate HQS 
Graduate Assistant, Japanese Ministry of International Trade and Industry (MITI) 
Presidential Management Internship Nominee",University of Notre Dame of Maryland,"Bachelors, Economics and Political Science","National Honor Society
Varsity Athlete - Swim Team, Volleyball Team",MBC_Thomas,https://twitter.com/MBC_Thomas,"Organizational Design, Organizational Effectiveness, Executive Visibility, Client Services, Communication, Coaching & Mentoring, Executive Management, Teamwork, Business Process Improvement, Strategic Partnerships, Community Outreach, Program Management, Relationship Building, Strategic Planning, Management, Fundraising, Public Relations, Leadership, Public Speaking, Nonprofits, Strategic Communications, Social Media, Event Planning, Marketing, Brand Awareness, Marketing Communications, Community Development, Strategy",Organizational Design,84,Organizational Effectiveness,148,Executive Visibility,84,Client Services,,Communication,,Coaching & Mentoring,1,maureenbcthomas,,,,,,,,,
,"https://www.linkedin.com/sales/lead/ACwAABgNPUkBxBAF3JxK0VPQmHkYRnrxXzAiHjY,NAME_SEARCH,qBUp",2023-07-19T19:22:32.106Z,https://www.linkedin.com/in/edgarnoumair/,ednoumair@hotmail.com,https://www.linkedin.com/in/edgarnoumair/,"I Advise & Lead Boards & Organizations on Actionable Decisions, Data & Learning Insights. I am a Visionary Leader who identifies, Designs, & Spearheads Transformational Human-Centric Environments through Agility🤸🏼‍♀️, Resilience 🏋🏻‍♂️ &, Sustainability ♾.",Data Scientist / Entrepreneur / Author / Artist / Athlete,Washington DC-Baltimore Area,https://media.licdn.com/dms/image/C5603AQFNGxEfMUsplw/profile-displayphoto-shrink_100_100/0/1625664472772?e=1695254400&v=beta&t=Am8HKGC3uPNrDfkNiCphhy6oibOTeeJy9tI02CZdWy8,Dr. Edgar,Noumair,Dr. Edgar Noumair,20163,2nd,ACoAABgNPUkBUULcmaup51M--hk827cONXrsnS4,403520841,"https://www.linkedin.com/sales/people/ACoAABgNPUkBUULcmaup51M--hk827cONXrsnS4,name",500,https://www.linkedin.com/search/results/people/?facetConnectionOf=%5B%22ACoAABgNPUkBUULcmaup51M--hk827cONXrsnS4%22%5D&facetNetwork=%5B%22F%22%2C%22S%22%5D&origin=MEMBER_PROFILE_CANNED_SEARCH,https://www.linkedin.com/search/results/people/?facetNetwork=%5B%22F%22%5D&facetConnectionOf=%5B%22ACoAABgNPUkBUULcmaup51M--hk827cONXrsnS4%22%5D&origin=MEMBER_PROFILE_CANNED_SEARCH&RESULT_TYPE=PEOPLE,"Tyrome Smith, Matthew Zeiler, and 4 other mutual connections",Gnoci,Managing Partner,Gnoci is a Management by Design firm that helps sustain organizations by being strategic and adaptive in face of disruptive environments. We apply agile practices in management and technology by adopting a humancentric approach to solving problems.,Global,Jun 2013 - Present,10 yrs 2 mos,Georgetown University,Professor of Practice,"Facilitated 50 Courses. Taught/mentored more than 50k Undergraduate, Graduate & Professional Students from different backgrounds industries. Chaired 5 Innovation Panels. Led 8 Technology and Learning consortiums for Faculty, Staff, Students, Alumni.",United States,Jun 2014 - Present,9 yrs 2 mos,Stanford University,https://www.linkedin.com/company/1792/,"R&D, Entrepreneurship & Innovation",,University of Pennsylvania,"Doctorate, Organizational Design & Learning",,EdgarNoumair,https://twitter.com/EdgarNoumair,"Human Resources (HR), Python (Programming Language), Higher Education, Teaching, Research, Grant Writing, Business Analysis, Agile Methodologies, Software as a Service (SaaS), Mergers & Acquisitions (M&A), Organizational Development, Leadership Development, Management Consulting, IT Management, Artificial Intelligence, Design, Change Management, Operations Management, Data Analysis, Risk Management, Venture Capital, Entrepreneurship, Strategy, Writing, Leadership, Decision Making, Conflict Resolution, Management, Mentoring, Public Speaking",Human Resources (HR),12,Python (Programming Language),12,Higher Education,18,Teaching,12,Research,10,Grant Writing,4,edgarnoumair,ednoumair@hotmail.com,https://www.linkedin.com/company/10522559/,https://www.linkedin.com/company/4794/,https://www.linkedin.com/company/3165/,gnoci.com,,,,
,"https://www.linkedin.com/sales/lead/ACwAAAE1YqQBZoy53iiEXT0Ol-GrNh_0U0dhvqM,NAME_SEARCH,2RCc",2023-07-19T19:22:51.105Z,https://www.linkedin.com/in/nrdavis/,,https://www.linkedin.com/in/nrdavis/,,Assisting Maryland's startup companies and entrepreneur support organizations.,"Towson, Maryland, United States",https://media.licdn.com/dms/image/D5603AQGPI--eZ5Ntgg/profile-displayphoto-shrink_100_100/0/1679941326211?e=1695254400&v=beta&t=SBVvVaRXhohfrsVnUqjMbpO_anCxdIhtLs_A1UMi3mA,Neil,Davis,Neil Davis,,2nd,ACoAAAE1YqQBdVPylY-Id95gIz8USDq7iSIo0gc,20275876,"https://www.linkedin.com/sales/people/ACoAAAE1YqQBdVPylY-Id95gIz8USDq7iSIo0gc,name",,https://www.linkedin.com/search/results/people/?facetConnectionOf=%5B%22ACoAAAE1YqQBdVPylY-Id95gIz8USDq7iSIo0gc%22%5D&facetNetwork=%5B%22F%22%2C%22S%22%5D&origin=MEMBER_PROFILE_CANNED_SEARCH,https://www.linkedin.com/search/results/people/?facetNetwork=%5B%22F%22%5D&facetConnectionOf=%5B%22ACoAAAE1YqQBdVPylY-Id95gIz8USDq7iSIo0gc%22%5D&origin=MEMBER_PROFILE_CANNED_SEARCH&RESULT_TYPE=PEOPLE,,TCP Venture Capital,General Partner | Propel 3 Fund,,"Baltimore, Maryland, United States",Jan 2021 - Present,2 yrs 7 mos,"Wexford Science & Technology, LLC",SciTech Venture Fund Advisory Board Member,,,Sep 2022 - Present,11 mos,University of Maryland,https://www.linkedin.com/company/3638/,"MBA, Finance",,Lafayette College,"BS, Mechanical Engineering",,,,"Entrepreneurship, Start-ups, Mergers, Strategic Planning, Business Strategy, New Business Development, Strategy, Business Development, Budgets, Recruiting, Mergers & Acquisitions, Management Consulting, Executive Management, Marketing, Management, Public Relations, Team Building, Leadership, Due Diligence, Project Planning, Strategic Partnerships, Program Management, Investments, Marketing Strategy",Entrepreneurship,97,Start-ups,93,Mergers,6,Strategic Planning,45,Business Strategy,23,New Business Development,22,nrdavis,,https://www.linkedin.com/company/5337426/,https://www.linkedin.com/company/1734721/,https://www.linkedin.com/company/19308/,,1979 - 1982,1971 - 1975,,
,"https://www.linkedin.com/sales/lead/ACwAAACRHSQB6TCtuIxEce2hAb9lV3NM_GzNPc8,NAME_SEARCH,p1VD",2023-07-19T19:23:08.967Z,https://www.linkedin.com/in/discoveringmind/,,https://www.linkedin.com/in/discoveringmind/,"I help corporate and real estate teams plan and execute M&A, financing, and investment transactions, including strategy, planning and execution of mergers & acquisitions, equity and mezzanine capital raises,  bank loans, institutional debt, alternative and investments, international investments, and capital transfer/exchange for business, trade, real estate and immigration purposes. 

I have led 23 successful M&A engagements and served in executive leadership roles in more than a dozen startups. I have chaired and served on public, private, and non-profit boards in many industries, including mortgage banking, insurance, financial services, real estate, government contracting, healthcare, wellness, pet care, education, distribution, food & beverage, travel, direct marketing, manufacturing, advertising specialties, waste management, and explosive ordnance disposal. My board experience ranges from start-ups to mature multi-national businesses.

I have a special passion for health and wellness, including meditation, mindfulness and yoga from both the Eastern wisdom traditions as well as modern evidence-based approaches.  I teach, mentor and coach meditation and spirituality as a basis for personal growth, leadership development, and both personal and professional transformation. 

Professional Highlights:

•	More than 30 years of senior level experience in M&A, corporate and real estate finance, real estate development, international forex and capital exchange, C-PACE lending, and EB-5 immigration investment transactions. 
•	Experienced in all aspects of raising and investing equity, debt and hybrid/mezzanine capital in public and private capital markets transactions. 
•	Experienced in global immigration, cross border payments, RMB capital exchange and forex.
•	Consummated dozens of M&A and financing transactions in both a principal capacity and on behalf of selected clients. 
•	Planned, financed and managed domestic and international projects in publicly-traded, privately-held and non-profit company environments.
•	Licensed proprietary equities trader and mortgage banker.
•      Extensive Asia and Middle East travel and business experience. Lived in India and China. Led humanitarian projects in Tibet, India, Nepal and China.","Finance/M&A Entrepreneur, Director & Advisor. Sustainable Investment. Meditation Expert.","Annapolis, Maryland, United States",https://media.licdn.com/dms/image/C4D03AQF-DLNvpJbKHw/profile-displayphoto-shrink_100_100/0/1642012043502?e=1695254400&v=beta&t=FVvsstQmDbJkdGRNIoPW38RBRFDWNq3c91RuFlWmVlE,Michael,Hess,Michael Hess,7058,2nd,ACoAAACRHSQBG5FTYOqcVvjXGrcAoFbJDo3fgGI,9510180,"https://www.linkedin.com/sales/people/ACoAAACRHSQBG5FTYOqcVvjXGrcAoFbJDo3fgGI,name",500,https://www.linkedin.com/search/results/people/?facetConnectionOf=%5B%22ACoAAACRHSQBG5FTYOqcVvjXGrcAoFbJDo3fgGI%22%5D&facetNetwork=%5B%22F%22%2C%22S%22%5D&origin=MEMBER_PROFILE_CANNED_SEARCH,https://www.linkedin.com/search/results/people/?facetNetwork=%5B%22F%22%5D&facetConnectionOf=%5B%22ACoAAACRHSQBG5FTYOqcVvjXGrcAoFbJDo3fgGI%22%5D&origin=MEMBER_PROFILE_CANNED_SEARCH&RESULT_TYPE=PEOPLE,,"ABS Advisory Services Group, Inc.",Chairman/CEO,"Manage mergers & acquisitions, corporate and real estate finance, mortgage banking and alternative investment transactions for an investment holding company, financial advisory firm, portfolio companies and various client companies including federally chartered banks, broker-dealers, state-licensed mortgage and insurance companies, law firms, real estate development and construction companies, and other financial services, health care, business services, renewable energy, wellness, and technology firms.  Developed global cross-border payment solutions for retail and institutional clients seeking capital exchange transactions with China and other countries.  Responsibilities include transaction management from concept to closing, strategic planning and financial advisory services.  Transactions include commercial and institutional credit facilities, reverse mergers, roll-ups, Reg D and Reg S private placements, PIPE offerings, residential real estate finance and international trade and investment projects in Asia and elsewhere.  Active equities, options and futures trader.","Annapolis, MD",Sep 1995 - Present,27 yrs 11 mos,Myron,"Advisory Director - Finance, M&A and Partnerships","Myron+Adler is one of the oldest and largest privately held advertising specialties companies in the world.  I work with the executive leadership and a team of advisors to position Myron as a leader in the global gifting industry.  Responsibilities include:

• Leading a working group comprised of the Chairman, CEO, CFO, and heads of European finance, planning/budgeting, and supply chain.
• Re-aligning P&L/budgeting, forecasting, and pricing to support a digital transformation strategy.
• Restructuring and expanding global banking and credit relationships.
• Advising shareholders and senior management on the successful sale of a majority stake to private equity.","Maywood, NJ and Saarbrücken, Germany",May 2021 - Present,2 yrs 3 mos,University of Maryland,https://www.linkedin.com/company/3638/,Bachelor of Science (BS) Magna Cum Laude,"College Park, Maryland (USA)",University of Oxford,Asian Language Study,,,,"Investments, Corporate Finance, Mergers & Acquisitions, Mortgage Banking, Equities, Investment Banking, Strategic Planning, Banking, Private Equity, Valuation, Due Diligence, Private Placements, Start-ups, Entrepreneurship, Capital Markets, Financial Services, Mortgage Lending, Proprietary Trading, Financial Modeling, Real Estate, Business Valuation",Investments,99,Corporate Finance,99,Mergers & Acquisitions,99,Mortgage Banking,10,Equities,65,Investment Banking,35,discoveringmind,,,https://www.linkedin.com/company/59839/,https://www.linkedin.com/company/4477/,,1986 - 1988,Jul 2021 - Aug 2021,,
,"https://www.linkedin.com/sales/lead/ACwAAADZA40Bmn2kVnOAiz0l7ix5q2sKM5nRPK8,NAME_SEARCH,QxpB",2023-08-01T21:40:07.036Z,https://www.linkedin.com/in/carl-j-wallace-55191a4/,,https://www.linkedin.com/in/carl-j-wallace-55191a4/,"CORPEXPERT - is an innovation consulting firm that provides services across a broad breath of industries and needs. Our engagements include fractional ""C"" level services - CFO for modeling, debt placements and banking relationships, CSO (strategy) for identifying opportunistic acquisitions, management buy outs, product placements, embedded entrepreneurs, CEO - for capital raising, presentations and team building. We have provided curriculum's for accelerators, vendor application management, commercialization plans for technologies funded by government agencies, business development services and personnel referrals. Our clients range from pre-revenue startups to technology companies with more than $100M in revenue. We are all about innovation whether its customer discovery, defining value propositions, creating a product launch strategy or creating and disseminating your executive summary. Contact information is included in our profile. Please reach out if you have any questions.",INNOVATION CONSULTANT/CORPORATE STRATEGY/FRACTIONAL C-LEVEL EXECUTIVE,"Herndon, Virginia, United States",https://media.licdn.com/dms/image/D4E03AQFnacmMcoVVXQ/profile-displayphoto-shrink_800_800/0/1680304115879?e=1696464000&v=beta&t=DIP-ZSAPNJwfdc6X1vQzl9ZInrqCDyEv-Xsd790wVY4,Carl J.,Wallace,Carl J. Wallace,7932,2nd,ACoAAADZA40BButzVEfSDyGPSKL4bu8OEfHbGwU,14222221,"https://www.linkedin.com/sales/people/ACoAAADZA40BButzVEfSDyGPSKL4bu8OEfHbGwU,name",7995,https://www.linkedin.com/search/results/people/?facetConnectionOf=%5B%22ACoAAADZA40BButzVEfSDyGPSKL4bu8OEfHbGwU%22%5D&facetNetwork=%5B%22F%22%2C%22S%22%5D&origin=MEMBER_PROFILE_CANNED_SEARCH,https://www.linkedin.com/search/results/people/?facetNetwork=%5B%22F%22%5D&facetConnectionOf=%5B%22ACoAAADZA40BButzVEfSDyGPSKL4bu8OEfHbGwU%22%5D&origin=MEMBER_PROFILE_CANNED_SEARCH&RESULT_TYPE=PEOPLE,"Daniel D. Kunitz, Mike Ravenscroft, and 5 other mutual connections",CORPEXPERT - Commercialize your Tech,Principal,"Corpexpert provides fractional ""C"" Level services to all types of early stage, small and mid-sized business firms. Chief Financial Officer, Chief Restructuring Officer, Chief Strategy Officer or Chief Executive Officer for companies in need of business plans, workouts, strategic plans, sales assistance, commercialization and corporate governance services. I can guide your company through difficult issues finding the right development partners, strategies, debt/equity placements, bank restructuring, authoring private placement memorandums and mergers and acquisitions.",Northern Virginia,Feb 2009 - Present,14 yrs 7 mos,National Science Foundation (NSF),Industry Mentor - CFO Tiami Networks,"Assisting clients in the NSF I CORP accelerator program as an industry mentor providing guidance and insight on the process of customer discovery, value proposition and more.",Washington DC-Baltimore Area · Remote,Mar 2023 - Present,6 mos,University of Maryland,https://www.linkedin.com/company/3638/,"Master's degree, School of Engineering - Technology Entrepreneurship",,National Louis University,"BA, Management",Attended Robert Morris University in Pgh prior to National Louis.,,,"International sales, Business Development, Government Contracting, Business, Management, Finance, Strategic Planning, Banking, Commercial Lending, Credit, Sales Management, Loans, International Sales, Restructuring, Mergers & Acquisitions, Portfolio Management, Small Business Lending, Risk Management, Commercial Banking, Leadership, Business Strategy, Financial Services, Executive Management, Analysis, Strategy",International sales,4,Business Development,54,Government Contracting,6,Business,6,Management,27,Finance,78,carl-j-wallace-55191a4,,https://www.linkedin.com/company/79959041/,https://www.linkedin.com/company/8599/,https://www.linkedin.com/company/17617/,corpexpert.com,2021 - Nov 2022,1994 - 1996,,
