error,baseUrl,timestamp,linkedinProfileUrl,email,linkedinProfile,description,headline,location,imgUrl,firstName,lastName,fullName,subscribers,connectionDegree,vmid,userId,linkedinSalesNavigatorUrl,connectionsCount,connectionsUrl,mutualConnectionsUrl,mutualConnectionsText,company,jobTitle,jobDescription,jobLocation,jobDateRange,jobDuration,company2,jobTitle2,jobDescription2,jobLocation2,jobDateRange2,jobDuration2,school,schoolUrl,schoolDegree,schoolDescription,school2,schoolDegree2,schoolDescription2,twitter,twitterProfileUrl,allSkills,skill1,endorsement1,skill2,endorsement2,skill3,endorsement3,skill4,endorsement4,skill5,endorsement5,skill6,endorsement6,profileId,mail,companyUrl,companyUrl2,schoolUrl2,website,schoolDateRange,schoolDateRange2,birthday,facebookUrl
,"https://www.linkedin.com/sales/lead/ACwAAABmB9IBPBHxl0v00xGSi6yFqn6RLdgX-tU,NAME_SEARCH,blq7",2023-08-02T06:41:55.964Z,https://www.linkedin.com/in/eric-spillman-72a2a52/,,https://www.linkedin.com/in/eric-spillman-72a2a52/,"Spillman Consulting provides expert outsourced business development and marketing services, including capture, strategic teaming (prime/sub, CTAs, and JVs), pipeline building, proposal management and development, marketing/branding materials, and pricing.

Proposal experience includes serving as Proposal Manager, Writer, Tech Editor, Solutioning Facilitation, Color Teams, QC/Compliance, DTP, and Final Page Turn, Production, Upload to DoD SAFE and other government portals.

Proposal responses developed for GWACs (OASIS, 8a STARS, VETS, ALLIANT), GSA PSS, RFPs, SF330/Brooks Act, Task Orders on IDIQs, IT vehicles such as ITES-3S, CIO-SP3, Agency vehicles such as SEAPORT-e/NexGen, and others.  

Market areas addressed in proposal responses include:    
	Environmental Compliance and Remediation
	Conservation and Natural Resources
	Professional Services - Engineering, Facilities, Scientific, Management/Admin
	Information Technology Products and Services
	Facilities Assessments and Asset Management
	Utilities/Energy – Including Privatization
	Base Operating Support Services (BOSS)

 
",President at Spillman Consulting ,"Olney Mill, Maryland, United States",https://media.licdn.com/dms/image/C4D03AQGbVZnVgRV0uw/profile-displayphoto-shrink_800_800/0/1639063640601?e=1696464000&v=beta&t=XXJQWlq20nK4QYR_-qZfQ-3HVLFWdHRU_g76pBv_-L4,Eric,Spillman,Eric Spillman,828,2nd,ACoAAABmB9IB5IRNbYlo2UPxfPk1WihLGpM13j4,6686674,"https://www.linkedin.com/sales/people/ACoAAABmB9IB5IRNbYlo2UPxfPk1WihLGpM13j4,name",833,https://www.linkedin.com/search/results/people/?facetConnectionOf=%5B%22ACoAAABmB9IB5IRNbYlo2UPxfPk1WihLGpM13j4%22%5D&facetNetwork=%5B%22F%22%2C%22S%22%5D&origin=MEMBER_PROFILE_CANNED_SEARCH,https://www.linkedin.com/search/results/people/?facetNetwork=%5B%22F%22%5D&facetConnectionOf=%5B%22ACoAAABmB9IB5IRNbYlo2UPxfPk1WihLGpM13j4%22%5D&origin=MEMBER_PROFILE_CANNED_SEARCH&RESULT_TYPE=PEOPLE,,"Spillman Consulting, Inc.",President,"Spillman Consulting, Inc. provides its small business clients with marketing and business development services to grow their presence and brand in the federal marketplace.  Our experienced professionals accomplish this through the use of competitive analysis tools; strategic teaming approaches such as, prime/sub, joint venture, mentor-protégé, and CTAs; tactical proposal planning and development; and targeted marketing at key industry conferences and workshops.  Our consultants are veterans of the small business industry and know how to achieve smart and sustainable small business growth. Spillman Consulting provides each of our small business clients with a total federal government business development solution tailored to meet their needs. This is all achieved at an affordable cost, as our proven business development professionals work on an as-needed basis, freeing our clients from the costs of carrying a full-time employee.  

Contact us today at erspillman@spillmanconsulting.com or 703-399-9282 for a free, introductory competitive analysis and more information on how we can help your business grow.",,Oct 2013 - Present,9 yrs 11 mos,"Pegasus Professional Services, LLC",Director of Business Development,,,2015 - 2016,1 yr,University of Maryland,https://www.linkedin.com/company/3638/,,,,,,,,"Environmental Awareness, Remediation, Proposal Writing, Environmental Compliance, Environmental Consulting, Government Contracting, NEPA, Hazardous Waste Management, Environmental Engineering, Sustainability, Program Management, Construction Management, DoD, Environmental Impact Assessment, Water, RCRA, Soil, Environmental Science, Environmental Management Systems, Groundwater Remediation, Groundwater",Environmental Awareness,36,Remediation,45,Proposal Writing,64,Environmental Compliance,64,Environmental Consulting,45,Government Contracting,28,eric-spillman-72a2a52,,,https://www.linkedin.com/company/3720273/,,,1982 - 1987,,,
,"https://www.linkedin.com/sales/lead/ACwAAAKdapIB1lz2axFP9DkpSMgJidRccyQcyZ0,NAME_SEARCH,xUup",2023-08-02T06:42:17.957Z,https://www.linkedin.com/in/denise-lee-queenofthecloud/,,https://www.linkedin.com/in/denise-lee-queenofthecloud/,"Transformational IT Leader offering leadership in high visibility complex initiatives driving efficiency, process improvements and continuous improvement in a variety of environments, bringing all stakeholders together and introducing new, faster ways of achieving results. Excellent skills in identifying pain points and executing solutions that surpass expectations. Collaborative, people-focused leader who develops teams’ creative capacities and allows for exploration. 

A natural ability to forge productive relationships and save costs. Operates at the intersection of program and project management, training, and technology implementations. Leads and challenges through strategic planning and project delivery, analyzing and improving business and IT processes, systems and operational performance. Expertly manages the lifecycle of programs and technical projects enabling organizational objectives with quality assured. Communicates and sells ideas, demonstrating the tangible value of new methodologies.
",Program Management Cloud Enthusiast ,Washington DC-Baltimore Area,https://media.licdn.com/dms/image/C4D03AQEx3D1yjJ9bKA/profile-displayphoto-shrink_800_800/0/1622542687602?e=1696464000&v=beta&t=D4MsgIsbfMhDVjf7mDZqR5C-OFLBH89AWmZDa4Ok8-g,Denise,"Lee, MSMIS, PMP, CSPO","Denise Lee, MSMIS, PMP, CSPO",1947,3rd,ACoAAAKdapIBQtrmT6T59R18nKYTyGWMKMWDWA0,43870866,"https://www.linkedin.com/sales/people/ACoAAAKdapIBQtrmT6T59R18nKYTyGWMKMWDWA0,name",1949,https://www.linkedin.com/search/results/people/?facetConnectionOf=%5B%22ACoAAAKdapIBQtrmT6T59R18nKYTyGWMKMWDWA0%22%5D&facetNetwork=%5B%22F%22%2C%22S%22%5D&origin=MEMBER_PROFILE_CANNED_SEARCH,https://www.linkedin.com/search/results/people/?facetNetwork=%5B%22F%22%5D&facetConnectionOf=%5B%22ACoAAAKdapIBQtrmT6T59R18nKYTyGWMKMWDWA0%22%5D&origin=MEMBER_PROFILE_CANNED_SEARCH&RESULT_TYPE=PEOPLE,,Amazon Web Services (AWS),Senior Engagement Manager,Skills: Portfolio Management · People Management · Product Management · Project Management Office (PMO) · Business Development · Strategic Communications · Resource Management · Project Portfolio Management · Business Process Mapping · Customer Satisfaction · IT Management · Cloud Computing · Infrastructure · Project Coordination · Operations Management · Project Delivery · Information Technology · Account Management · Budgeting · Agile Methodologies · Quality Management · Customer Relationship Management (CRM) · Government · Program Management · Leadership · Proposal Writing,Washington DC-Baltimore Area,Jun 2021 - Present,2 yrs 3 mos,KPMG US,Advisory Manager,"Trained, coached, implemented and managed Scaled Agile Framework (SAFe) principles and processes into the Naval Operational Business Logistics Enterprise (NOBLE) Integrated Data Environment (IDE).",,Apr 2021 - May 2021,2 mos,University of Maryland,https://www.linkedin.com/company/3638/,"Bachelor of Arts, Hearing and Speech Sciences",,University of Maryland Global Campus,"Master of Science: Management, Information Systems and Services",Skills: Project Portfolio Management · Strategic Communications,,,"Portfolio Management, People Management, Product Management, Project Management Office (PMO), Business Development, Microsoft 365, Strategic Communications, Resource Management, Project Portfolio Management, Business Process Mapping, Customer Satisfaction, IT Management, Cloud Computing, Infrastructure, Project Coordination, Operations Management, Project Delivery, Information Technology, Account Management, Budgeting, Agile Methodologies, Quality Management, Customer Relationship Management (CRM), Policy, Change Management, Software Project Management, Project Management, Requirements Analysis, Process Improvement, Government, Microsoft Office, Business Analysis, SharePoint, Analysis, Program Management, Leadership, Management, MS Project, Data Analysis, Business Intelligence",Portfolio Management,64,People Management,105,Product Management,32,Project Management Office (PMO),105,Business Development,64,Microsoft 365,53,denise-lee-queenofthecloud,,https://www.linkedin.com/company/2382910/,https://www.linkedin.com/company/1079/,https://www.linkedin.com/company/9375/,,2005 - 2009,2009 - 2011,,
,"https://www.linkedin.com/sales/lead/ACwAAAYDRCsBiF_LKxK4fK0ricPtqYmtJ3WljF0,NAME_SEARCH,wYAq",2023-08-02T06:42:37.267Z,https://www.linkedin.com/in/joearmstead/,,https://www.linkedin.com/in/joearmstead/,,"SVP, Human Capital at Vistant",Washington DC-Baltimore Area,https://media.licdn.com/dms/image/C4D03AQHnJzgtI-0V7g/profile-displayphoto-shrink_800_800/0/1530735317638?e=1696464000&v=beta&t=i-ld9GwVW1n-IIXCkOKnHbGojRG73Z-oEOF0HLR2T3w,Joe,Armstead,Joe Armstead,430,3rd,ACoAAAYDRCsBJoko06oH8bavUwvW_KctsZ5kWXc,100877355,"https://www.linkedin.com/sales/people/ACoAAAYDRCsBJoko06oH8bavUwvW_KctsZ5kWXc,name",421,https://www.linkedin.com/search/results/people/?facetConnectionOf=%5B%22ACoAAAYDRCsBJoko06oH8bavUwvW_KctsZ5kWXc%22%5D&facetNetwork=%5B%22F%22%2C%22S%22%5D&origin=MEMBER_PROFILE_CANNED_SEARCH,https://www.linkedin.com/search/results/people/?facetNetwork=%5B%22F%22%5D&facetConnectionOf=%5B%22ACoAAAYDRCsBJoko06oH8bavUwvW_KctsZ5kWXc%22%5D&origin=MEMBER_PROFILE_CANNED_SEARCH&RESULT_TYPE=PEOPLE,,PM Consulting Group,Chief Human Capital Officer,,,May 2020 - Present,3 yrs 4 mos,ICAT Logistics,Director of Administration & Human Resources,,,Oct 2007 - Feb 2017,9 yrs 5 mos,University of Maryland,https://www.linkedin.com/company/3638/,Business Management / Accounting,,University of Maryland Global Campus,Business Management / Accounting,,,,"Human Resources, Employee Relations, Strategic Planning, Team Building, Process Improvement, Leadership, Customer Service, Management, Employee Benefits, Coaching, Project Management, Recruiting, Benefits Administration, Employee Engagement, Logistics, Performance Management, Team Leadership, Customer Satisfaction, Budgets, Change Management, Contract Negotiation, Leadership Development, Operations Management",Human Resources,29,Employee Relations,14,Strategic Planning,17,Team Building,13,Process Improvement,10,Leadership,21,joearmstead,,https://www.linkedin.com/company/10025334/,https://www.linkedin.com/company/91060/,https://www.linkedin.com/company/9375/,linkedin.com/redirect?url=http://www.icatlogistics.com&urlhash=x8Xz,,,,
,"https://www.linkedin.com/sales/lead/ACwAAADIv7MBYT-ASwXZtvOnxAWfRxh-TlG4ScA,NAME_SEARCH,NpVW",2023-08-02T06:42:57.011Z,https://www.linkedin.com/in/laurel-thompson-7034a54/,,https://www.linkedin.com/in/laurel-thompson-7034a54/,"Accomplished real estate, facilities management, workplace experience professional with proven track record of delivering superior client and tenant services. Recognized for ability to coach teams, mentor and grow operations teams, analyze problems, develop and implement solutions while reducing operating costs and improving safety in the workplace. Proficient in managing multiple projects simultaneously and effectively coordinating activities across all departments. Effective communicator.","Real Estate | Facilities Management | Workplace Experience | Mentor | Coach---- Director of Administration, Cornerstone Research",Washington DC-Baltimore Area,https://media.licdn.com/dms/image/C4D03AQEajSXF81Govw/profile-displayphoto-shrink_800_800/0/1628716033979?e=1696464000&v=beta&t=tW8DNNQkUM0zCuzJpA2QJhw-S-kc6LuszahPbaWHX-o,Laurel,Thompson,Laurel Thompson,,3rd,ACoAAADIv7MB9Et9T8TB44zPYsZvWK_C576UhqA,13156275,"https://www.linkedin.com/sales/people/ACoAAADIv7MB9Et9T8TB44zPYsZvWK_C576UhqA,name",951,https://www.linkedin.com/search/results/people/?facetConnectionOf=%5B%22ACoAAADIv7MB9Et9T8TB44zPYsZvWK_C576UhqA%22%5D&facetNetwork=%5B%22F%22%2C%22S%22%5D&origin=MEMBER_PROFILE_CANNED_SEARCH,https://www.linkedin.com/search/results/people/?facetNetwork=%5B%22F%22%5D&facetConnectionOf=%5B%22ACoAAADIv7MB9Et9T8TB44zPYsZvWK_C576UhqA%22%5D&origin=MEMBER_PROFILE_CANNED_SEARCH&RESULT_TYPE=PEOPLE,,Cornerstone Research,Director of Facilities & Administration,,"Washington, District of Columbia, United States",Nov 2021 - Present,1 yr 10 mos,Sodexo at Fannie Mae,Executive Director-Integrated Facilities Management,,Washington D.C. Metro Area,Nov 2018 - Nov 2021,3 yrs 1 mo,University of Maryland,https://www.linkedin.com/company/3638/,"Bachelors, Liberal Arts/Interior Design",,,,,,,"Contract Negotiation, Project Management, Strategic Planning, Team Leadership, Strategic Communications, Commercial Real Estate, Open Space Planning, Customer Support, Travel Management, Construction Management, Staff Management, Staff Supervision, Management, Event Management, Crisis Management, Social Media, Public Relations, Media Relations, Corporate Communications, Internal Communications, Crisis Communications, Change Management, Event Planning, Corporate Social Responsibility, Contract Management, Leadership, Negotiation, Strategy, People Management",Contract Negotiation,7,Project Management,23,Strategic Planning,16,Team Leadership,20,Strategic Communications,10,Commercial Real Estate,3,laurel-thompson-7034a54,,https://www.linkedin.com/company/5345/,,,apcoworldwide.com,1981 - 1985,,,
,"https://www.linkedin.com/sales/lead/ACwAAAVbWpMBphO6pHCNNQk_Z2SD1qaGsub8QfE,NAME_SEARCH,X8KU",2023-08-02T06:43:18.813Z,https://www.linkedin.com/in/ricky-scott-mba-a4312126/,,https://www.linkedin.com/in/ricky-scott-mba-a4312126/,"Ricky has over a decade of marketing and communications experience in the areas of relationship development, brand strategy, vendor management, team management, internal and external engagement, societal impact, and delivering exceptional client experiences. His goal is to leverage his leadership, experience, and pioneering nature to deliver on key initiatives and uncover and drive new revenue opportunities.

At Deloitte Global, Ricky is a Marketing Lead for Global Tax & Legal and was the recipient of Deloitte's inaugural Global Impact Award given for impacting 1,000+ futures through social programming. Additionally, Ricky is the founder of Lenox Ave Productions, a media production house, as well as an alumni of Mayor Muriel Bowser's 202Creates Residency Program. He was honored as the DC Office of Cable Television, Film, Music and Entertainment Filmmaker of the Month in April 2022.

Ricky holds a Bachelor of Arts in Public Relations & Criminal Justice from the University of Maryland, College Park and a Master's of Business Administration from the University of Maryland, University College.","Manager, Communications | Office of the Global Chair","Washington, District of Columbia, United States",,Ricky,"Scott, MBA","Ricky Scott, MBA",1089,2nd,ACoAAAVbWpMBCb0nO71mEycerF1tivAmBSQjrCs,89873043,"https://www.linkedin.com/sales/people/ACoAAAVbWpMBCb0nO71mEycerF1tivAmBSQjrCs,name",1077,https://www.linkedin.com/search/results/people/?facetConnectionOf=%5B%22ACoAAAVbWpMBCb0nO71mEycerF1tivAmBSQjrCs%22%5D&facetNetwork=%5B%22F%22%2C%22S%22%5D&origin=MEMBER_PROFILE_CANNED_SEARCH,https://www.linkedin.com/search/results/people/?facetNetwork=%5B%22F%22%5D&facetConnectionOf=%5B%22ACoAAAVbWpMBCb0nO71mEycerF1tivAmBSQjrCs%22%5D&origin=MEMBER_PROFILE_CANNED_SEARCH&RESULT_TYPE=PEOPLE,,Deloitte,"Manager, Communications | Office of the Global Chair",,"Washington, District of Columbia, United States",Jun 2023 - Present,3 mos,Deloitte,Marketing Lead | Global Tax & Legal,Skills: Branding · Strategic Communications · Strategic Planning · Business Development · Writing · Communication · Analytical Skills · Digital Marketing,"Washington, District of Columbia, United States",Jun 2022 - Jun 2023,1 yr 1 mo,University of Maryland,https://www.linkedin.com/company/3638/,"Bachelor of Arts (B.A.), Public Relations, Advertising, and Applied Communication",,University of Maryland,"Bachelor of Arts (B.A.), Criminal Justice/Law Enforcement Administration",,,,"Branding, Strategic Communications, Strategic Planning, Business Development, Writing, Event Management, Copywriting, Communication, Analytical Skills, Digital Marketing, Social Networking, Microsoft Office, Press Releases, Public Speaking, PowerPoint, Research, Event Planning, Microsoft Excel, Microsoft Word, InDesign, Adobe Creative Suite, Public Relations, Copy Editing, Video Editing, Editing, Tutoring, Programming, Facebook, Social Media Measurement, Social Media, Leadership, Customer Service, Microsoft PowerPoint, Adobe Premiere Pro, Metrics, Creative Writing, Project Management, Video Production, Content Development, Digital Media, Strategy",Branding,31,Strategic Communications,94,Strategic Planning,62,Business Development,52,Writing,127,Event Management,32,ricky-scott-mba-a4312126,,https://www.linkedin.com/company/1038/,https://www.linkedin.com/company/1038/,https://www.linkedin.com/company/3638/,,2009 - 2013,2009 - 2013,,
,"https://www.linkedin.com/sales/lead/ACwAAANodI0BZnCtXYbdiFPTF_R6-x7WfFRT-SM,NAME_SEARCH,sqQT",2023-08-02T09:40:05.331Z,https://www.linkedin.com/in/coleycbj/,coy.coley@gmail.com,https://www.linkedin.com/in/coleycbj/,"I am the motivating, behind-the-scenes colleague that you refer hard assignments and tasks that operationally needs laser focus. I revel in the ability to analyze the issue, develop a response, and accomplish the mission regardless of its constraints.  I enjoy identifying gaps, analyzing the process and putting a plan into action.   When not in my office at my desk, I am building my network among peers, subject matter experts, and potential collaborators. I work best in an atmosphere which promotes taking the initiative, increasing operational efficiency, and innovative solutions.

I have a desire to mentor and help develop the next generation whether at my office or in a classroom setting. I also have a lifelong love for learning. Thus, I have begun my doctoral studies part time to attain that last credential in life: PhD.

When I am not at work, I am an amateur astronomer and overall science fan searching for small contributions to save the world.",Program Manager at Booz Allen Hamilton,Washington DC-Baltimore Area,https://media.licdn.com/dms/image/C4D03AQFYuJDb0fA7DQ/profile-displayphoto-shrink_800_800/0/1516621959199?e=1696464000&v=beta&t=Lc4IcRsEmwyqBgHEm3w4cMiWosVfuzMuE_Z3VRfVPbw,Coy,C.,Coy C.,537,3rd,ACoAAANodI0BRMWFK9lgOMITMrLIxt6GK1w5w4k,57177229,"https://www.linkedin.com/sales/people/ACoAAANodI0BRMWFK9lgOMITMrLIxt6GK1w5w4k,name",543,https://www.linkedin.com/search/results/people/?facetConnectionOf=%5B%22ACoAAANodI0BRMWFK9lgOMITMrLIxt6GK1w5w4k%22%5D&facetNetwork=%5B%22F%22%2C%22S%22%5D&origin=MEMBER_PROFILE_CANNED_SEARCH,https://www.linkedin.com/search/results/people/?facetNetwork=%5B%22F%22%5D&facetConnectionOf=%5B%22ACoAAANodI0BRMWFK9lgOMITMrLIxt6GK1w5w4k%22%5D&origin=MEMBER_PROFILE_CANNED_SEARCH&RESULT_TYPE=PEOPLE,,Booz Allen Hamilton,Program Manager,,,Mar 2021 - Present,2 yrs 6 mos,U.S. Army Reserve,Operations Manager,,Washington D.C. Metro Area,Sep 2003 - Present,20 yrs,Capitol Technology University,https://www.linkedin.com/company/46114/,"Doctor of Philosophy - PhD, Critical Infrastructure",,University of Maryland,"Master of Public Administration - MPA, Public Management",,,,"HSEEP Training, Professional Development Series, Professional Continuity Practitioner, Emergency Management, Homeland Security, Preparedness, Exercises, Strategic Planning, Government, Microsoft Office, MS Project, HSEEP, Staff Development, Program Management, Training, Analysis, Management, Policy, Risk Assessment, National Security, Project Management, Risk Management, Project Planning, Strategy, Information Assurance, Mentoring, Teaching, Investigation, Leadership, Microsoft Excel, Microsoft Word, Microsoft PowerPoint, Microsoft Outlook, Microsoft Project, Microsoft Access, Windows, Macroeconomics, Mac & PC platforms, Customer Service, Stakeholder Management, R, Databases, Public Speaking",HSEEP Training,1,Professional Development Series,1,Professional Continuity Practitioner,1,Emergency Management,26,Homeland Security,12,Preparedness,7,coleycbj,coy.coley@gmail.com,https://www.linkedin.com/company/1403/,https://www.linkedin.com/company/1938783/,https://www.linkedin.com/company/3638/,,2020 - 2023,2017 - 2020,,
,"https://www.linkedin.com/sales/lead/ACwAAACxBJMBXXKiX09cjiIPWZKOSOBVbhsgC8U,NAME_SEARCH,GB69",2023-08-02T09:40:29.375Z,https://www.linkedin.com/in/tram-l-697a753/,,https://www.linkedin.com/in/tram-l-697a753/,"Human Resources professional with more than 20 years of experience. I am a proactive business partner with extensive experience providing full service HR support and direction to department managers and employees from recruiting and hiring, through compliance, training and benefits. Over the course of my career, I have applied my passion for implementing creative HR programs for companies to support the organization's strategic initiatives and workplace goals. 
","Director of People Operations at Ellumen, Inc.",Washington DC-Baltimore Area,,Tram,L.,Tram L.,1440,2nd,ACoAAACxBJMBCqhsrRRFhVY2YtSTYlCI4S9MKAg,11601043,"https://www.linkedin.com/sales/people/ACoAAACxBJMBCqhsrRRFhVY2YtSTYlCI4S9MKAg,name",500,https://www.linkedin.com/search/results/people/?facetConnectionOf=%5B%22ACoAAACxBJMBCqhsrRRFhVY2YtSTYlCI4S9MKAg%22%5D&facetNetwork=%5B%22F%22%2C%22S%22%5D&origin=MEMBER_PROFILE_CANNED_SEARCH,https://www.linkedin.com/search/results/people/?facetNetwork=%5B%22F%22%5D&facetConnectionOf=%5B%22ACoAAACxBJMBCqhsrRRFhVY2YtSTYlCI4S9MKAg%22%5D&origin=MEMBER_PROFILE_CANNED_SEARCH&RESULT_TYPE=PEOPLE,,"Ellumen, Inc.",Director of People Operations,"Oversee preboarding, onboarding, employee relations, compliance, talent rewards, and day-to-day people operations.",Remote,Feb 2023 - Present,7 mos,"Ellumen, Inc.",Human Resources Manager,"Helped company to obtain Top Workplace employer recognition through the Washington Post. Was also recognized as a STAR performer of the month. 
- Oversee compensation & benefits administration, communications, and manage 3rd party relations
- Coach employees and leaders to cultivate company culture and values
- Ensures company compliance as a government contractor
- Manages end to end recruiting process
- Directs and oversees performance management systems and processes
- Lead, support, develop direct reports",,Feb 2021 - Mar 2023,2 yrs 2 mos,University of Maryland,https://www.linkedin.com/company/3638/,"B.A, Sociology",,,,,,,"Onboarding, Employee Engagement, Talent Management, Leadership, Recruiting, HRIS, Employee Benefits, Employee Relations, Benefits Administration, Outlook, Management, Training, Talent Acquisition, Deferred Compensation, New Hire Orientations, Personnel Management, HR Policies, Performance Management, FMLA, Policy, Temporary Placement, Human Resources, Internet Recruiting, U.S. Family and Medical Leave Act (FMLA), Human Resources Information Systems (HRIS)",Onboarding,108,Employee Engagement,108,Talent Management,108,Leadership,65,Recruiting,33,HRIS,37,tram-l-697a753,,https://www.linkedin.com/company/586502/,https://www.linkedin.com/company/586502/,,shrm.org,,,,
